<!ELEMENT PROFILE ANY>
<!ELEMENT SETTING (CONFIGNAME,OPERATOR,VALUE)>
<!ELEMENT CONFIGNAME (#PCDATA)>
<!ELEMENT OPERATOR (#PCDATA)>
<!ELEMENT VALUE (#PCDATA)>


