<?xml version = "1.0" encoding ="UTF-8" standalone = "no"?>
<!DOCTYPE PROFILE SYSTEM "../profile.dtd">
<PROFILE>
	<SETTING>
	<CONFIGNAME>vm/bdflush:6</CONFIGNAME>
	<OPERATOR>geq</OPERATOR>
	<VALUE>6000</VALUE>
	</SETTING>

	<SETTING>
	<CONFIGNAME>vm/bdflush:1</CONFIGNAME>
	<OPERATOR>geq</OPERATOR>
	<VALUE>60</VALUE>
	</SETTING>

	<SETTING>
	<CONFIGNAME>PMMX_LOWPOWER</CONFIGNAME>
	<OPERATOR>geq</OPERATOR>
	<VALUE>1</VALUE>
	</SETTING>

	<SETTING>
	<CONFIGNAME>PMMX_DISABLE_AUTOHALT</CONFIGNAME>
	<OPERATOR>geq</OPERATOR>
	<VALUE>1</VALUE>
	</SETTING>

	<SETTING>
	<CONFIGNAME>VAIO_LCD_BRIGHTNESS</CONFIGNAME>
	<OPERATOR>geq</OPERATOR>
	<VALUE>255</VALUE>
	</SETTING>
</PROFILE>
