<?xml version = "1.0" encoding ="UTF-8" standalone = "no"?>
<!DOCTYPE PROFILE SYSTEM "../profile.dtd">
<PROFILE>
	<SETTING>
	<CONFIGNAME>net/ipv4/tcp_syncookies/CONFIGNAME>
	<OPERATOR>=</OPERATOR>
	<VALUE>1</VALUE>
	</SETTING>

	<SETTING>
	<CONFIGNAME>kernel/panic</CONFIGNAME>
	<OPERATOR>geq</OPERATOR>
	<VALUE>1</VALUE>
	</SETTING>

	<SETTING>
	<CONFIGNAME>net/ipv4/ip_dynaddr</CONFIGNAME>
	<OPERATOR>=</OPERATOR>
	<VALUE>1</VALUE>
	</SETTING>

	<SETTING>
	<CONFIGNAME>net/ipv4/ip_always_defrag</CONFIGNAME>
	<OPERATOR>=</OPERATOR>
	<VALUE>0</VALUE>
	</SETTING>

	<SETTING>
	<CONFIGNAME>net/ipv4/ip_forward</CONFIGNAME>
	<OPERATOR>=</OPERATOR>
	<VALUE>1</VALUE>
	</SETTING>

	<SETTING>
	<CONFIGNAME>net/ipv4/route/mtu_expires</CONFIGNAME>
	<OPERATOR>geq</OPERATOR>
	<VALUE>1800</VALUE>
	</SETTING>

	<SETTING>
	<CONFIGNAME>vm/freepages:3</CONFIGNAME>
	<OPERATOR>geq</OPERATOR>
	<VALUE>512</VALUE>
	</SETTING>

	<SETTING>
	<CONFIGNAME>NET_TCPIP_DEV_PROXY_ARPeth0</CONFIGNAME>
	<OPERATOR>=</OPERATOR>
	<VALUE>1</VALUE>
	</SETTING>

	<SETTING>
	<CONFIGNAME>NET_TCPIP_DEV_ACCEPT_RP_FILTEReth0</CONFIGNAME>
	<OPERATOR>=</OPERATOR>
	<VALUE>1</VALUE>
	</SETTING>

</PROFILE>
